Screen ID,Destinations,Destination Count
MUL-130,"Mattapan, Forest Hills, Dedham Mall, Walpole Center via Washington St, VA Hospital, Baker & Vermont St, Wren St, Back Bay, Georgetowne, Cleary Square, Reservoir, Forest Hills via South Bay Center, Andrew via South Bay Center, Ashmont, Wolcott Square, Nubian",16
PRE-199,"Oak Grove, Union Square, Medford/Tufts, North Station, Forest Hills, Riverside, Heath Street, Wachusett, Haverhill, Lowell, Newburyport, Rockport",12
PRE-160,"Government Center, Union Square, Medford/Tufts, Braintree, Ashmont, Alewife, Mattapan, Forest Hills, Oak Grove, Boston College, Cleveland Circle, Riverside, Heath Street, Bowdoin, Wonderland, Logan Airport, South Station, Design Center, Chelsea, Nubian, Downtown, Silver Line Way, Readville, Fall River, New Bedford, Wachusett, North Station, Worcester, Forge Park/495, Foxboro, Winthrop Loop, Quincy Loop, Greenbush, Haverhill, Kingston, Lowell, Needham Heights, Newburyport, Rockport, Wickford Junction, Stoughton, Providence, Hyannis, Charlestown Navy Yard, Long Wharf, Hingham, Rowes Wharf, Hingham via Logan Airport & Hull, Hingham via Hull, Long Wharf via Hull & Logan Airport, Long Wharf via Hull & Georges Island, Lewis Mall Wharf, Blossom Street Pier, Winthrop/Quincy Loop, Avenue Louis Pasteur (Limited Stops), Beth Israel (Limited Stops), Andrew (Limited Stops), Harvard, North Station via South Station, Design Center via South Station, Otis & Summer, Harbor Point via South Bay Center, Kenmore via South Bay Center, City Point, Copley, City Point via South Bay Center, Arlington via South Bay Center, Chauncy & Summer, Roslindale Square, Heath St, Fields Corner, Ruggles, Forest Hills via South Bay Center, Andrew via South Bay Center, Andrew, Kenmore, Wakefield Ave, Ashmont via Washington St, Gallivan Blvd via Norfolk St, Mattapan via Franklin Field, Jackson Square via Franklin Field, Wolcott Square, River St & Milton St, Dedham Mall, Walpole Center via Washington St, VA Hospital, Baker & Vermont St, Wren St, Back Bay, Georgetowne, Centre St & Eliot St, JFK/UMass, Park St & Tremont St, Jackson Square, Franklin Park, Central Square, Broadway, Cleary Square, Reservoir, Watertown Yard, West Fenway, Arlington, Needham Junction via Needham St, Watertown Square via Needham St, Chestnut Hill Mall, North Waltham, Waltham Center, Bedford VA, Oak Square, Kendall/MIT, Brighton Center, Harvard via Allston, Nubian via Allston, Turkey Hill via Arlington Center, Alewife via Arlington Center, Lechmere, Market Place Dr, University Park, Watertown Square, Waverley, Belmont Center, Lincoln Lab via Hanscom Airport, Lincoln Lab, Alewife via Hanscom Airport, Arlington Heights, Arlmont Village, Arlington Center, Rindge Ave, Assembly, Clarendon Hill, Davis, Sullivan, Haymarket via Sullivan, Sullivan via Navy Yard, Medford Square, West Medford, Malden, Wellington, Woodland Rd, Elm St, Airport, Lebanon Loop, Linden Square, Linden Square via Sullivan, Harvard via Sullivan, Woodlawn, Haymarket, Wellington via Admiral's Hill & Market Basket, Wood Island via Market Basket & Admiral's Hill, Mystic Mall, Maverick, Northgate, Northgate via Tomasello Way, Beachmont, Beachmont via Tomasello Way, Orient Heights via Waldemar, Maverick via Jeffries Point, Eagle Square, Wood Island, Melrose Highlands via Oak Grove, Malden via Oak Grove, Redstone, Reading Depot, Logan Airport via Andrew, Fields Corner via Adams St, Keystone Apts via Adams St, Fields Corner via Neponset Ave, Quincy Center, Squantum, Houghs Neck via Germantown, Quincy Center via North Quincy, Ashmont via North Quincy, Hingham Depot via Shipyard, Quincy Center via Shipyard, Washington St & Pleasant St Weymouth, East Weymouth, Weymouth Landing via Quincy Ave, Weymouth Landing via Southern Artery, Quincy Center via Southern Artery, Quincy Center via Quincy Ave, Columbian Square, Montello, South Shore Plaza, Holbrook/Randolph, Avon Square, Holbrook/Randolph via Crawford Square, North Burlington via Mall Rd, Alewife via Mall Rd, Bedford Woods Dr via EMD Serono, Bedford Woods Dr, Third Ave, Third Ave via EMD Serono, Burlington (Express) via Woburn, Burlington via Medford Square, West Cummings & Woburn (Express), Boston (Express) via Woburn, Kennedy Dr, Jack Satter House, Eastern & Essex via Western Ave, Central Square via Cliftondale, Haymarket via Cliftondale, Oaklandvale via Cliftondale (Express), Haymarket via Cliftondale (Express), Northgate Shopping Center via Square One Mall, Central Square via Square One Mall, Saugus Center via Square One Mall, Malden via Square One Mall, Salem Depot, Neptune Towers, Liberty Tree via North Shore Mall & Lynnfield St, Central Square via Malls & Lynnfield St, Nahant, Nahant via Central Square, Wonderland via Central Square, Marblehead via Central Square & Paradise Rd, Wonderland via Paradise Rd & Central Square, Ocean St via Central Square, Marblehead via Central Square & Humphrey St, Wonderland via Central Square & Humphrey St, North Beverly via Tozer Rd, North Beverly via Cabot St, Salem Depot via Cabot St, Salem Depot via Tozer Rd & Cummings, Salem Depot via Central Square, Brighton via Copley (Express), Downtown via Copley (Express), Downtown via Cambridge St and Copley (Express), Watertown via Copley and Newton Corner (Express), Waltham (Express), Downtown (Express), Roberts, Newton Corner, Waltham Highlands, Point Shirley, Winthrop Beach, Orient Heights, Hull Ferry, Hingham Depot, Canton Village Shoppes, Forge Park/495 (Shuttle), Canton Junction (Shuttle)",240
PRE-201,"Oak Grove, Union Square, Medford/Tufts, North Station, Forest Hills, Riverside, Heath Street, Wachusett, Haverhill, Lowell, Newburyport, Rockport",12
Audio-Ruggles,,0
PRE-190,"Forest Hills, Oak Grove, Wonderland, Bowdoin",4
MUL-132,"Ruggles, Davis, Central Square, Linden Square via Sullivan, Harvard via Sullivan, Assembly, Haymarket via Sullivan, Downtown, Arlington Center, West Medford, Malden",11
PRE-153,"Boston College, Cleveland Circle, Riverside, Heath Street, Braintree, Ashmont, Alewife, Mattapan, Forest Hills, Oak Grove, Government Center, Union Square, Medford/Tufts, Bowdoin, Wonderland, Logan Airport, South Station, Design Center, Chelsea, Nubian, Downtown, Silver Line Way, Readville, Fall River, New Bedford, Wachusett, North Station, Worcester, Forge Park/495, Foxboro, Winthrop Loop, Quincy Loop, Greenbush, Haverhill, Kingston, Lowell, Needham Heights, Newburyport, Rockport, Wickford Junction, Stoughton, Providence, Hyannis, Charlestown Navy Yard, Long Wharf, Hingham, Rowes Wharf, Hingham via Logan Airport & Hull, Hingham via Hull, Long Wharf via Hull & Logan Airport, Long Wharf via Hull & Georges Island, Lewis Mall Wharf, Blossom Street Pier, Winthrop/Quincy Loop, Avenue Louis Pasteur (Limited Stops), Beth Israel (Limited Stops), Andrew (Limited Stops), Harvard, North Station via South Station, Design Center via South Station, Otis & Summer, Harbor Point via South Bay Center, Kenmore via South Bay Center, City Point, Copley, City Point via South Bay Center, Arlington via South Bay Center, Chauncy & Summer, Roslindale Square, Heath St, Fields Corner, Ruggles, Forest Hills via South Bay Center, Andrew via South Bay Center, Andrew, Kenmore, Wakefield Ave, Ashmont via Washington St, Gallivan Blvd via Norfolk St, Mattapan via Franklin Field, Jackson Square via Franklin Field, Wolcott Square, River St & Milton St, Dedham Mall, Walpole Center via Washington St, VA Hospital, Baker & Vermont St, Wren St, Back Bay, Georgetowne, Centre St & Eliot St, JFK/UMass, Park St & Tremont St, Jackson Square, Franklin Park, Central Square, Broadway, Cleary Square, Reservoir, Watertown Yard, West Fenway, Arlington, Needham Junction via Needham St, Watertown Square via Needham St, Chestnut Hill Mall, North Waltham, Waltham Center, Bedford VA, Oak Square, Kendall/MIT, Brighton Center, Harvard via Allston, Nubian via Allston, Turkey Hill via Arlington Center, Alewife via Arlington Center, Lechmere, Market Place Dr, University Park, Watertown Square, Waverley, Belmont Center, Lincoln Lab via Hanscom Airport, Lincoln Lab, Alewife via Hanscom Airport, Arlington Heights, Arlmont Village, Arlington Center, Rindge Ave, Assembly, Clarendon Hill, Davis, Sullivan, Haymarket via Sullivan, Sullivan via Navy Yard, Medford Square, West Medford, Malden, Wellington, Woodland Rd, Elm St, Airport, Lebanon Loop, Linden Square, Linden Square via Sullivan, Harvard via Sullivan, Woodlawn, Haymarket, Wellington via Admiral's Hill & Market Basket, Wood Island via Market Basket & Admiral's Hill, Mystic Mall, Maverick, Northgate, Northgate via Tomasello Way, Beachmont, Beachmont via Tomasello Way, Orient Heights via Waldemar, Maverick via Jeffries Point, Eagle Square, Wood Island, Melrose Highlands via Oak Grove, Malden via Oak Grove, Redstone, Reading Depot, Logan Airport via Andrew, Fields Corner via Adams St, Keystone Apts via Adams St, Fields Corner via Neponset Ave, Quincy Center, Squantum, Houghs Neck via Germantown, Quincy Center via North Quincy, Ashmont via North Quincy, Hingham Depot via Shipyard, Quincy Center via Shipyard, Washington St & Pleasant St Weymouth, East Weymouth, Weymouth Landing via Quincy Ave, Weymouth Landing via Southern Artery, Quincy Center via Southern Artery, Quincy Center via Quincy Ave, Columbian Square, Montello, South Shore Plaza, Holbrook/Randolph, Avon Square, Holbrook/Randolph via Crawford Square, North Burlington via Mall Rd, Alewife via Mall Rd, Bedford Woods Dr via EMD Serono, Bedford Woods Dr, Third Ave, Third Ave via EMD Serono, Burlington (Express) via Woburn, Burlington via Medford Square, West Cummings & Woburn (Express), Boston (Express) via Woburn, Kennedy Dr, Jack Satter House, Eastern & Essex via Western Ave, Central Square via Cliftondale, Haymarket via Cliftondale, Oaklandvale via Cliftondale (Express), Haymarket via Cliftondale (Express), Northgate Shopping Center via Square One Mall, Central Square via Square One Mall, Saugus Center via Square One Mall, Malden via Square One Mall, Salem Depot, Neptune Towers, Liberty Tree via North Shore Mall & Lynnfield St, Central Square via Malls & Lynnfield St, Nahant, Nahant via Central Square, Wonderland via Central Square, Marblehead via Central Square & Paradise Rd, Wonderland via Paradise Rd & Central Square, Ocean St via Central Square, Marblehead via Central Square & Humphrey St, Wonderland via Central Square & Humphrey St, North Beverly via Tozer Rd, North Beverly via Cabot St, Salem Depot via Cabot St, Salem Depot via Tozer Rd & Cummings, Salem Depot via Central Square, Brighton via Copley (Express), Downtown via Copley (Express), Downtown via Cambridge St and Copley (Express), Watertown via Copley and Newton Corner (Express), Waltham (Express), Downtown (Express), Roberts, Newton Corner, Waltham Highlands, Point Shirley, Winthrop Beach, Orient Heights, Hull Ferry, Hingham Depot, Canton Village Shoppes, Forge Park/495 (Shuttle), Canton Junction (Shuttle)",240
PRE-189,"Bowdoin, Wonderland, Oak Grove, Forest Hills",4
Audio-Ashmont,"Ashmont, Alewife, Mattapan, Andrew, Forest Hills, Ruggles, Wakefield Ave, Ashmont via Washington St, Gallivan Blvd via Norfolk St, Quincy Center, Quincy Center via North Quincy, Ashmont via North Quincy, Avon Square, Holbrook/Randolph via Crawford Square",14
MUL-110,"Avenue Louis Pasteur (Limited Stops), Beth Israel (Limited Stops), Andrew (Limited Stops), Harbor Point via South Bay Center, Kenmore via South Bay Center, Fields Corner, Kenmore, Ashmont, Mattapan, Ruggles, Park St & Tremont St, Jackson Square, Franklin Park, Central Square, Broadway, Assembly, Forest Hills, Oak Grove, Forge Park/495, South Station, Needham Heights, Wickford Junction, Stoughton",23
MUL-133,"Wonderland, Wellington, Maverick, Malden, Wonderland via Central Square, Wonderland via Paradise Rd & Central Square, Wonderland via Central Square & Humphrey St, Bowdoin, Jack Satter House, Eastern & Essex via Western Ave, Nahant via Central Square, Marblehead via Central Square & Paradise Rd, Ocean St via Central Square, Marblehead via Central Square & Humphrey St, Salem Depot via Central Square",15
PRE-158,"Braintree, Ashmont, Harvard via Allston, Watertown Square, Waverley, Belmont Center, Arlington Heights, Arlmont Village, Harvard, Medford Square, Linden Square via Sullivan, Nubian, Nubian via Allston, Kendall/MIT, Lechmere, Reservoir, Harvard via Sullivan",17
TPS-105,"Fall River, New Bedford, South Station, Holbrook/Randolph, Quincy Center, Holbrook/Randolph via Crawford Square, Ashmont, Avon Square",8
MUL-123,"Forest Hills, Roslindale Square, Ashmont, Mattapan via Franklin Field, Mattapan, Centre St & Eliot St, Jackson Square, Oak Grove, Heath St, Ruggles, Jackson Square via Franklin Field, JFK/UMass",12
MUL-126,"Nubian, Wolcott Square, Oak Grove, South Station, Andrew via South Bay Center, Forest Hills, Back Bay, Needham Heights, Forest Hills via South Bay Center, Ashmont, Mattapan, Dedham Mall, Walpole Center via Washington St, VA Hospital, Baker & Vermont St, Wren St, Georgetowne, Cleary Square, Reservoir",19
TPS-116,"Oak Grove, Forest Hills, Union Square, Medford/Tufts, Riverside, Heath Street, Wonderland",7
MUL-146,"Wakefield Ave, Ashmont, Mattapan, Forest Hills, River St & Milton St, Quincy Center, Canton Village Shoppes, Ruggles, Mattapan via Franklin Field, Jackson Square via Franklin Field",10
TPS-123,"North Station, Wachusett",2
PRE-102,"Government Center, Union Square, Medford/Tufts, Wonderland, Boston College, Cleveland Circle, Riverside, Heath Street, Bowdoin",9
TPS-122,"Ashmont, Fall River, New Bedford, South Station, Holbrook/Randolph, Quincy Center, Holbrook/Randolph via Crawford Square",7
MUL-101,"Alewife, Mattapan, Ashmont, Andrew, Forest Hills, Ruggles, Wakefield Ave, Ashmont via Washington St, Gallivan Blvd via Norfolk St, Quincy Center, Quincy Center via North Quincy, Ashmont via North Quincy, Avon Square, Holbrook/Randolph via Crawford Square",14
bpl-adams-street-V2,"Alewife, Mattapan, Ashmont, Andrew, Forest Hills, Ruggles, Wakefield Ave, Ashmont via Washington St, Gallivan Blvd via Norfolk St, Quincy Center, Quincy Center via North Quincy, Ashmont via North Quincy, Avon Square, Holbrook/Randolph via Crawford Square, Fields Corner via Adams St, Keystone Apts via Adams St",16
MUL-112-V2,"Bowdoin, Wonderland, Wellington, Maverick, Jack Satter House, Malden, Eastern & Essex via Western Ave, Nahant via Central Square, Wonderland via Central Square, Marblehead via Central Square & Paradise Rd, Wonderland via Paradise Rd & Central Square, Ocean St via Central Square, Marblehead via Central Square & Humphrey St, Wonderland via Central Square & Humphrey St, Salem Depot via Central Square",15
